Audio file,Start,End,Text Full Verbatim
Hari Minggoean_001,0:34:37,0:35:21,"Ada kesalahan beberapa teknis karena memang Namanya cowok ya, ya kami gak bisa dibilang profesional juga sih ya Itu latihan pada males-malesan, bolong-bolongan Gak setiap saat itu Apa namanya, full latihannya Full team maksudnya, jadinya ya begitulah Tapi intinya aku seneng, nampil walaupun di tempat paling gak enak di Jogja buat nampil, yaitu di KM0 Ya itu tempat paling chaos boy Aku bertahun-tahun berkali, ya nggak berkali-kali sih, ada kali tiga, tiga, empat kali nampil di KM","Ada kesalahan beberapa teknis karena memang Namanya cowok ya, ya kami gak bisa dibilang profesional juga sih ya Itu latihan pada males-malesan, bolong-bolongan Gak setiap saat itu Apa namanya, full latihannya Full team maksudnya, jadinya ya begitulah Tapi intinya aku seneng, nampil walaupun di tempat paling gak enak di Jogja buat nampil, yaitu di KM0 Ya itu tempat paling chaos boy Aku bertahun-tahun berkali, ya nggak berkali-kali sih, ada kali tiga, tiga, empat kali nampil di KM"
Hari Minggoean_001,0:35:21,0:35:26,0 dan di arah sekitaran situ. Selalu keus.,0 dan di arah sekitaran situ. Selalu keus.
Hari Minggoean_001,0:35:26,0:35:37,"Selalu capek nunggunya, di situ nggak ada apa-apa. Gak ada tempat buat nunggu, gak ada ruang transit segala macem kalau panas-panas, kalau malam kedinginan-kedinginan.","Selalu capek nunggunya, di situ nggak ada apa-apa. Gak ada tempat buat nunggu, gak ada ruang transit segala macem kalau panas-panas, kalau malam kedinginan-kedinginan."
Hari Minggoean_001,0:35:37,0:35:41,Wah itu gila Tapi tetap aja walaupun.,Wah itu gila Tapi tetap aja walaupun.
Hari Minggoean_001,0:35:41,0:36:01,"Kondisinya tidak ideal Buatku tetap menyenangkan karena bisa menari lagi bersama sanggar yang sama Yang mendidikku dan jiwa kesenian tariku juga Ya, mungkin itulah untuk episode minggu ini. Banyak banget yang diobrolin. Dan banyak.","Kondisinya tidak ideal Buatku tetap menyenangkan karena bisa menari lagi bersama sanggar yang sama Yang mendidikku dan jiwa kesenian tariku juga Ya, mungkin itulah untuk episode minggu ini. Banyak banget yang diobrolin. Dan banyak."
Hari Minggoean_001,0:36:01,0:36:10,Hahaha yang nggak jelas. Aku harap kalian yang dengerin bisa menikmati pun. Kalau nggak.,Hahaha yang nggak jelas. Aku harap kalian yang dengerin bisa menikmati pun. Kalau nggak.
Hari Minggoean_001,0:36:10,0:36:31,"Bisa menikmati nggak apa-apa. Kalian bisa buka dan dengerin sebentar. Aku juga udah seneng. Dan terima kasih banget kalau kalian bisa dengerin sampai akhir episode ini Kita bakal ketemu lagi Insyaallah, semoga aku tidak malas dan harus tidak malas Di episode atau minggu berikutnya.","Bisa menikmati nggak apa-apa. Kalian bisa buka dan dengerin sebentar. Aku juga udah seneng. Dan terima kasih banget kalau kalian bisa dengerin sampai akhir episode ini Kita bakal ketemu lagi Insyaallah, semoga aku tidak malas dan harus tidak malas Di episode atau minggu berikutnya."
Hari Minggoean_001,0:36:31,0:36:35,Sampai jumpa.,Sampai jumpa.
